<?xml version="1.0" encoding="UTF-8"?>
<schema xmlns="http://www.w3.org/2001/XMLSchema"
        targetNamespace="http://www.example.org/extendedUnit"
        xmlns:tns="http://www.example.org/extendedUnit"
        elementFormDefault="qualified">

    <element name="xml">
        <complexType>
            <sequence>
                <element name="extendedUnit" type="tns:extendedUnit" minOccurs="0" maxOccurs="unbounded"/>
            </sequence>
        </complexType>
    </element>

    <complexType name="extendedUnit">
        <sequence>
            <element name="name" type="string"/>
            <element name="derivedQuantityRef" type="string"/>
            <element name="quantityExtensionRef" type="string"/>
        </sequence>
        <attribute name="ref" type="tns:refType" use="required"/>
    </complexType>

    <simpleType name="refType">
        <restriction base="string">
            <pattern value="([a-z0-9_-])*"/>
        </restriction>
    </simpleType>
</schema>